{
  "schema_version": "1.0",
  "authorization_id": "authority-example-lab",
  "status": "draft",
  "mode": "balanced",
  "policy": {
    "id": "default-baseline",
    "version": "2.0",
    "digest": "sha256:a2a758c85dfaf0ae96cb914da7a84ce4fb949a78c1460a30b5a8b731ca566d95"
  },
  "target": {
    "name": "example-lab",
    "environment": "lab",
    "owner": "platform-owner",
    "profile_digest": "sha256:0000000000000000000000000000000000000000000000000000000000000000"
  },
  "executor": "service:codex",
  "actions": [
    "container_rollout",
    "run_tests",
    "build_release"
  ],
  "scope": [
    "service:api"
  ],
  "data_classifications": [
    "internal"
  ],
  "allow_stateful": false,
  "allow_external_side_effects": true,
  "window_start": "2026-10-30T10:00:00Z",
  "window_end": "2026-10-30T11:00:00Z",
  "trusted_environment": null,
  "authorizations": []
}
